{
  "cycle_id": "2026-07-16-mvrv-01",
  "indicator": "MVRV",
  "source": {
    "name": "VantageNode",
    "url": "https://vantagenode.io/terminal#metric=878185e596",
    "captured_by": "Mr. G — transferência manual da aba VantageNode",
    "captured_at": "2026-07-17T00:00:00+00:00"
  },
  "as_of": "2026-07-16",
  "unit": "ratio",
  "latest_value": 1.208,
  "series": [
    { "t": "2026-06-18", "v": 1.176 },
    { "t": "2026-06-22", "v": 1.196 },
    { "t": "2026-07-02", "v": 1.156 },
    { "t": "2026-07-04", "v": 1.189 },
    { "t": "2026-07-08", "v": 1.174 },
    { "t": "2026-07-13", "v": 1.168 },
    { "t": "2026-07-16", "v": 1.208 }
  ],
  "notes": "valores conferidos na tela da VantageNode (MVRV Ratio), via tooltip do gráfico 30D, captura manual em 2026-07-17."
}
