{
  "cycle_id": "2026-07-18-sopr-lth-01",
  "indicator": "SOPR-LTH",
  "source": {
    "name": "VantageNode",
    "url": "",
    "captured_by": "Mr. G — transferência manual (hover diário, gráfico 30D)",
    "captured_at": "2026-07-18T00:00:00+00:00"
  },
  "as_of": "2026-07-17",
  "unit": "ratio",
  "latest_value": 0.8529,
  "series": [
    {
      "t": "2026-06-18",
      "v": 0.7357
    },
    {
      "t": "2026-06-19",
      "v": 0.7118
    },
    {
      "t": "2026-06-20",
      "v": 0.87
    },
    {
      "t": "2026-06-22",
      "v": 0.7994
    },
    {
      "t": "2026-06-23",
      "v": 0.7904
    },
    {
      "t": "2026-06-24",
      "v": 0.6955
    },
    {
      "t": "2026-06-25",
      "v": 0.6617
    },
    {
      "t": "2026-06-26",
      "v": 0.6664
    },
    {
      "t": "2026-06-27",
      "v": 0.9789
    },
    {
      "t": "2026-06-28",
      "v": 0.8494
    },
    {
      "t": "2026-06-29",
      "v": 0.6434
    },
    {
      "t": "2026-06-30",
      "v": 0.6158
    },
    {
      "t": "2026-07-01",
      "v": 0.767
    },
    {
      "t": "2026-07-02",
      "v": 0.8568
    },
    {
      "t": "2026-07-03",
      "v": 1.0253
    },
    {
      "t": "2026-07-04",
      "v": 0.8682
    },
    {
      "t": "2026-07-05",
      "v": 0.9408
    },
    {
      "t": "2026-07-06",
      "v": 0.7616
    },
    {
      "t": "2026-07-07",
      "v": 0.8552
    },
    {
      "t": "2026-07-08",
      "v": 0.7373
    },
    {
      "t": "2026-07-09",
      "v": 0.6995
    },
    {
      "t": "2026-07-10",
      "v": 0.7114
    },
    {
      "t": "2026-07-11",
      "v": 0.922
    },
    {
      "t": "2026-07-12",
      "v": 1.3364
    },
    {
      "t": "2026-07-13",
      "v": 0.888
    },
    {
      "t": "2026-07-14",
      "v": 0.7348
    },
    {
      "t": "2026-07-15",
      "v": 0.7398
    },
    {
      "t": "2026-07-16",
      "v": 1.1176
    },
    {
      "t": "2026-07-17",
      "v": 0.8529
    }
  ],
  "notes": "SOPR de long-term holders, 30D. Gap real em 2026-06-21 OMITIDO (hover não retornou tooltip; valor não inventado). 2026-07-18 intraday=0.7114 (ainda em formação) NÃO incluído como fechamento; último fechamento completo = 2026-07-17 (0.8529). Contexto pontual (não série): SOPR agregado 0.9718, SOPR STH 0.9849."
}
