{
  "cycle_id": "mock-block-test-01",
  "indicator": "MVRV",
  "source": {
    "name": "VantageNode",
    "url": "https://vantagenode.io/terminal#metric=878185e596",
    "captured_by": "MOCK — fixture de teste do GATEKEEPER (não é dado real)",
    "captured_at": "2026-07-17T00:00:00+00:00"
  },
  "as_of": "2026-07-17",
  "unit": "ratio",
  "latest_value": 1.15,
  "series": [
    { "t": "2026-07-10", "v": 1.10 },
    { "t": "2026-07-13", "v": 1.12 },
    { "t": "2026-07-17", "v": 1.15 }
  ],
  "notes": "MOCK para testar o caminho de BLOQUEIO do GATEKEEPER. Não usar em publicação."
}
